FileName,Our_Ref,Valuer_Name,Valuer_Qualifications,Valuer_Company,Market_Value_Kshs,Insurance_Value_Kshs,Forced_Sale_Value_Kshs,Open_Market_Rental_Value_Kshs,Valuation_Date,Inspection_Date,Lease_Start_Date,Transfer_Date,Consent_To_Transfer_Date,LR_No,IR_No,Title_No,Apartment_No,Unit_Type,Block,Floor_Level,Estate_Name,County,Area_Neighborhood,Road_Access_Description,Distance_To_Landmark,Google_Coordinates_Lat,Google_Coordinates_Lon,Built_Up_Area_SqFt,Plot_Area_Ha,Plot_Area_Acres,Bedrooms,Master_EnSuite,Parking_Spaces,Balcony_Present,Accommodation_Summary,Condition,Occupancy_Status,Internal_Finishes,Tenure,Lease_Term_Remaining,Encumbrances,Registered_Proprietor,Page_Count,Notes
APARTMENT NO G2 BLOCK G SIMBA VILLAS EMBAKASI NAIROBI COUNTY (3).pdf,SOO/DO0/5313/1/25,SIMBA VILLAS,EMBA,NW Realite Limited,N/A,N/A,N/A,N/A,2025-04-17,2025-04-17,1988-04-01,N/A,N/A,9042/685,112579,N/A,G2 (BLOCK G) ON L,APARTMENT,G,upper,SIMBA VILLAS,ILLAS EMBAKASI AREA NAIROBI COUNTY,SIMBA VILLAS EMBAKASI AREA,and to the west of Airport North Road,620 meters to the East of Quickmatt Supermarket Embakasi,-1.309694,36.919806,1100,N/A,N/A,3,Yes,2,Yes,-,good,owner-occupied,"ceramic, tiles, wardrobes, cupboards, stainless steel sink, timber, wooden, ceramic worktops",leasehold interest,99 years from 1988-04-01,that may be registered against the title.,Emmanuel Morris Murangiri Murithi and Nyakairu Ngovi. Encumbrances Nil. --- PAGE BREAK --- Flat No. G2 on L.R. No,27,Missing fields count: 9
doc39542520250203100758 NJORO-NGATA BLOCK 2-5138 RVIST AREA KIAMBU COUNTY.pdf,SOO/AM/5290/1/25,rectors home,Nahashon,N/A,2,2200000,3,N/A,2017-07-17,N/A,N/A,N/A,N/A,N/A,N/A,N/A,N/A,flat,2,N/A,Hons UoN,ELDORET HIGHWAY NAKURU COUNTY,RVIST area,N/A,N/A,-25.278889,723.485556,491,.0465,0.114904,3,Yes,2,Yes,-,N/A,occupied,timber,freehold interest,N/A,that may be registered against the title.,Joash Naman Ochieng,17,Missing fields count: 15
HOPE OF CHILDREN VALUATION REPORT.pdf,We,accept no responsibility if this should prove not to be so.,The Valuation is ba,NW Realite Limited,N/A,N/A,N/A,N/A,2025-06-15,N/A,1904-01-01,N/A,N/A,182/16-20,N/A,N/A,N/A,N/A,N/A,ground,Hons UoN,KIKUYU KIAMBU COUNTY,ONDIRI AREA,N/A,N/A,-1.241250,36.650306,960,19.274,47.627049,5,No,2,No,N/A,N/A,Vacant,"ceramic, tiles, wardrobes, cupboards, timber",Leasehold,999 years from 1904-01-01,that may be registered against,Tumaini Ministries,31,Missing fields count: 16
LR NO 12648-200 LUKENYA AREA MOMBASA ROAD MACHAKOS COUNTY.pdf,SOO/DOO/5330/1/25,LUKENYA AREA,MOMBA,N/A,30,N/A,N/A,N/A,2013-04-30,N/A,1920-01-01,N/A,N/A,12648/200,272210,N/A,N/A,N/A,N/A,N/A,Agency,A AREA MOMBASA ROAD MACHAKOS COUNTY,LUKENYA AREA,Mombasa Road,N/A,-1.483486,37.050606,N/A,000,0.000000,N/A,No,N/A,No,N/A,N/A,vacant,N/A,leasehold interest,999 years from 1920-01-01,that may be registered against the,N/A,16,Missing fields count: 20
LR NO 12715-14621 AHADI COURT-OFF COMMUNITY ROAD SYOKIMAU AREA MACHAKOS COUNTY.pdf,SOO/DOO/5301/1/25,AHADI COURT-OFF COMMUNITY ROAD SYOKIMAU AREA MACHAKOS COUNTY,"TERMS OF REFERENCE We received instructions from Branch Manager, KCB Ba",N/A,N/A,1600000000,N/A,5,2017-07-17,N/A,1983-11-01,N/A,N/A,12715/14621,217740,N/A,N/A,maisonette,N/A,ground,Agency,ROAD SYOKIMAU AREA MACHAKOS COUNTY,OFF COMMUNITY ROAD SYOKIMAU AREA,Community Road,N/A,-1.363917,36.934778,360,N/A,N/A,4,Yes,1,Yes,-,N/A,owner-occupied,"ceramic, tiles, wardrobes, cupboards, timber, wooden",leasehold interest,99 years from 1983-11-01,that may be registered against the,Meshack Akoko Otieno,21,Missing fields count: 13
LR NO 21096-175 JASPARA HOUSE JUJA TOWN KIAMBU COUNTY.pdf,SOO/4881/2/25,accept no responsibility if this should prove not to be so.,The Valuation is ba,N/A,N/A,N/A,N/A,N/A,1995-11-01,N/A,1995-11-01,N/A,N/A,21096/175,N/A,N/A,N/A,flat,featuring,ground,Agency,ASPARA HOUSE JUJA TOWN KIAMBU COUNTY,PLOT AREA,N/A,N/A,-723.485556,25.278889,850,0.0310,0.076603,1,No,8,No,-,fair,N/A,"ceramic, tiles, timber",leasehold interest,99 years from 1995-11-01,that may be registered against,Menno Plaza Limited,28,Missing fields count: 14
LR NO 23153-53&54 BARGONI AREA LAMU COUNTY.pdf,SOO/DOO/5304/1/25,BARGONI AREA LAMU COUNTY TERMS OF REFERENCE,"We received instructions from the Recovery Manager, KCB Ba",NW Realite Limited,N/A,N/A,N/A,N/A,1 GPK 3400,N/A,N/A,N/A,N/A,52890,52890,N/A,N/A,N/A,N/A,N/A,Agency,BARGONI AREA LAMU COUNTY,BARGONI AREA,N/A,N/A,-2.100972,40.762556,N/A,20.24,50.014085,N/A,No,N/A,No,N/A,N/A,VACANT,N/A,leasehold interest,99 years from N/A,that may be registered against,Maalims Ranching Company Limited. --- PAGE BREAK --- L,22,Missing fields count: 21
